{
 "schema_version": 1,
 "target": "vanreede1792",
 "title": "Van Reede to William V, Berlin 4 Feb 1792 (DECODE R1057)",
 "documents": [
  {
   "id": "DECODE R1057",
   "shelfmark": "KHA The Hague, Prins Willem V, inv.nr. 205",
   "date": "4 Feb 1792",
   "year": 1792,
   "country": "Dutch Republic",
   "route": "Berlin -> The Hague",
   "language": "French",
   "pages": 1,
   "cleartext_in_document": "separate passages",
   "plaintext": {"location": ["interlinear"], "partial": true},
   "length": {"tokens": 83, "distinct": 79, "unit": "code groups", "measured": true, "file": "ciphertext_R1057.txt"},
   "transcription": {
    "by": "DECODE",
    "source": "DECODE document D1939",
    "corrections": 1,
    "image_quality": "good",
    "notes": "4204 corrected to 4202 (tro) from the image and gloss."
   }
  }
 ],
 "system": {
  "types": ["code", "nomenclator"],
  "summary": "The 1782 one-part French Grand Chiffre of William V (DECODE key R1024, 1-5000), with a declared tail of null groups.",
  "symbol_kind": "digits",
  "digit_groups": {"width": "variable", "separation": "dots"},
  "distinct_symbols": 0,
  "diacritics": {"used": false},
  "homophones": {"used": false},
  "nomenclator": {"present": true, "entries": 4732, "kinds": ["syllables", "common words", "names", "titles", "phrases"], "unread_groups": 0},
  "nulls": {"present": true, "count": 21},
  "key_order": "alphabetical",
  "word_division": "none",
  "doubled_letters": "unknown",
  "sibling_key": "DECODE R1024, already used to read vanreede1787 (R1026/R1027).",
  "notes": "The plaintext itself declares the final 21 groups non-valeurs."
 },
 "conditions": {
  "prior_solution": {
   "exists": "partial",
   "where": "Contemporary interlinear gloss over the first eight lines, transcribed garbled on DECODE; the null tail was never glossed.",
   "found": "before attempt",
   "used": true
  },
  "inputs": ["images", "transcription", "crib", "sibling key"],
  "attack": "key from archive",
  "human_role": "The human supplied the target and the DECODE cookie.",
  "tools": ["decode_grand_chiffre.py"],
  "models": ["claude-opus-5"],
  "sessions": 1,
  "first_date": "2026-09-21",
  "last_date": "2026-09-21"
 },
 "solution": [
  {"date": "2026-09-21", "kind": "access", "what": "Record, transcription and image already downloaded in the vanreede1787 session.", "result": "worked"},
  {"date": "2026-09-21", "kind": "sibling key", "what": "Decoded all groups with key R1024 (Grand Chiffre).", "result": "worked"},
  {"date": "2026-09-21", "kind": "verification", "what": "Checked groups against the image and interlinear gloss; corrected 4204 to 4202.", "result": "worked"},
  {"date": "2026-09-21", "kind": "reading", "what": "Read: lemon-juice invisible ink on the enclosure's blank half-pages, for Larrey to pass to the Prince; last 21 groups declared nulls.", "result": "worked"}
 ],
 "outcome": {
  "class": "read",
  "fraction_read": 1.0,
  "grades": {"H": 0, "C": 0, "M": 0, "I": 0},
  "verification": ["matched control", "historical consistency"],
  "notes": "All 62 message groups read; the 21 remaining groups are nulls by the letter's own statement. The enclosure in invisible ink is not on the record."
 }
}
